toby@gmail.com,cs1531,Pathologist,"9:00 10:00 11:00 12:00 1:00 2:00 3:00 4:00 5:00","Monday Tuesday Wednesday Thursday Friday Saturday Sunday",10
gary@gmail.com,cs1531,GP,"8:00 9:00 10:00 11:00 1:00 2:00 3:00 4:00 5:00 6:00 7:00 8:00","Monday Tuesday Wednesday Thursday Friday",15
samuel@gmail.com,cs1531,GP,"9:00 10:00 11:00 12:00 1:00 2:00 3:00 4:00 5:00 6:00","Tuesday Wednesday Thursday Friday Saturday",20
sid@gmail.com,cs1531,Pathologist,"12:00 1:00 2:00 3:00 4:00 5:00 6:00 7:00","Wednesday Thursday",10
michael@gmail.com,cs1531,Physiotherapist,"10:00 11:00 12:00 1:00 2:00 3:00 4:00 5:00","Monday Tuesday Wednesday Thursday",15
anna@gmail.com,cs1531,GP,"8:00 9:00 10:00 11:00 12:00 1:00 2:00 3:00 4:00 5:00 6:00 7:00 8:00","Thursday Friday Saturday Sunday",20
thomas@gmail.com,cs1531,Pharmacist,"9:00 10:00 11:00 2:00 3:00 4:00 5:00 6:00","Monday Tuesday Wednesday Thursday Friday",10
ian@gmail.com,cs1531,Physiotherapist,"10:00 11:00 12:00 1:00 2:00 3:00 4:00 5:00","Monday Tuesday Wednesday Thursday Friday Saturday Sunday",15
